5g is coming sooner than you might think the 359 ep 362  cnet  chatting about 5g deployments the asus zenfo ,
is the phone call a thing of the past ,
yall which color phone should i get,
evildevil666 si t tjr moche au bout de 250 selfie cest rien cest le tlphone qui fonctionne mal jete le,
k3sro ich habs auch und mag vor allem die kamera der umstieg vom iphone fiel mir aber einige tage schwer und me ,
chatcher2 after saying hed monitor every penny 31k spent on a dining set for hud secretary ben carsons office ,
caseyneistat people often ask how i take my running selfies  its really simple i find a broken folding chair and a messed up traffi,
my phone is always about to die when i actually need it ,
me ha gustado un vdeo de youtube ,
mckbeth just off phone with several ppl in ghouta  one resident ventured outside to take this of a strike that rocked his neighbourh,
pettymamii my phone be so dry i be in my settings like ooouuu what this do  ,
jastrupgeeky abegiiiiiiiiiiiiiiiiiiiiiiiiiiiii  ,
rekkabell when i draw i sometime like to take pics by phone of pencil drawings and draw over them digitally,
my realestate brain com learn geek tech know economy forex learn science number of people killed by anim ,
they are towing cars in bio parking lot,
catgirl321 extremely urgentplease help if you can   please sharewatch his videospledge foster rescuesanantonio tx dogs,
theapplepost concepts imagine new gold iphone x and iphone x plus ,
bryan does not deserve a phone  ,
pizzahut yes after a painful and lengthy phone conversation with several different depaments,
i should be working but instead im on my phone forever procrastinating ,
using your phone at dinner isnt just rude it also makes you unhappy ,
pettymamii my phone be so dry i be in my settings like ooouuu what this do  ,
opensky hi im trying to check my balance over the phone but both of your numbers hang up on me when i call them,
jpluskay dont tell me that im your woman crush today pay my cell phone bill to show me you care instead,
onelondonco follow   retweet to win this apple iphone x 256gb giveawayends 28218 competition iphonex ,
master core titans shockwave screenuke is like tossing a stone into the air conditioner sitting in front of a computer,
ultimatehamster there are multiple types of palettes so maybe im taking up painting in my free time ,
can someone tell me how to screen record on myiphone,
ruemaw petition to replace all hunting games with petting simulatorsdeer hunting more like deer petting pet those deer give em tr,
turned off my phone to write this paper that is due tomorrow but i got my computer still soooo ,
nastlygal o seu iphone  o 5s,
apple iphone x vs samsung galaxy s9 specs comparison  we put the two most powerful smaphones in the world head ,
arvindpassey blogchatter allroadnoroad 2road trips are always thereon bikes in buses and carsbullock cas where roads are u,
gordiluv hey there i am godwin akpan i am an illustrator and concept aist i love painting epic scale environments wearenigerianc,
jackieaina were all grownpeople have lives jobs obligations etc unless youre my man my manager or family dont expect that,
merkel warms to blue badge idea after diesel ban ruling  cou move to allow cities to exclude polluting cars beco ,
the clone wars iphone x copycats battle for notch supremacy  former tottenham hotspur soccer player ledley king l ,
baqatacount                      ,
anyone interested in buying some cruz airo roof bars 118cm with fitting kit for mondeo mk4 bars will fit other ca ,
this girl outside my window keeps calling her dogs name over and over but his name is han or ahn or something so i ,
riceandstew yall so this is my screensaver and my manager had my phone in her hand shes white the way my hea was beating i wa,
wheelhousevets roads   paths are actively being gritted with rock salt during this freezing weather but this can prove a danger to pe,
jeffrabjohns epic peegs podcast with jared jeffries so many stories iubb mike davis impersonation bob knight 2002 fife cove,
idk who i think i am not having a case on my phone,
va inspector general finds no evidence of computer hacking in travel scandal ,
debbierfischer comfo therapy dogs waiting to greet stoneman douglas kids this morning for their first day back msdstrong ,
lmao see yu gotta get it together n txt the right number ,
quetonii sometimes i wish i could reach into my phone grab their phone and fling it out the window,
just sitting here next to my charger letting my phone die,
soaliive trvpl0rd21  ,
faceinthenews i actually dont like answering my phone,
mohdwasimakra14 muftgyan malala antonioguterres unspokesperson un humanrightdiedinsyriatoday is being persecution all are si,
amirulazahan i was smoking when i saw a bangladeshi sat not that far from me around the corner of this building he was looking at hi,
ttyonna im about to at montclair cause im tired of yall shit answer the phone,
amaechi lmao which phone you dey use,
mayakanai65 haha i was about to send a tweet with all the nittygritty details but i guess i dont have to now ,
browiththefiow girls love dogs more than they love guys,
health number of people killed by animals each year in the us remains unchanged  bites kicks and stings from f ,
whatsapp para iphone se actualiza con nuevos stickers dinmicos de tiempo y ubicacin  whatsapp para ios introdujo ,
amazons alexa takes opensource route to beat google into cars ,
the only thing apple should be placing ads for is reduced pricing for the iphone ,
therealmrsazon eric schmidt of google went to nk in 2013 and built a custom computer network there allowing obama administration d,
just caught pleky on his phone whispering something to someone at a 514 area code number he better be ordering raz ,
i agreetoo many dogs need homes thats not what life is ,
stephabouttown hello sisi saw that very interesting download it onto my phone,
ahsanr vladimir volegov painting ,
vice its downright disturbingpeople outside cars are dying at levels we havent seen in 25 years ,
physioniyi may credit ale kill your phone battery this week and beyond amen,
nothingyouhear for the best resultsfollow all on all 3 carsretweet all 3 carsfollow everyone who retweetscome back later and see i,
ekuco my main computer just got broke and staed many noisesi will cancel this afternoon streaming because of thati hope it c,
a look at two excellent news apps for the iphone 4s  for an extreme manual for all things apple iphone 4s related ,
aditi08 my brother is missing is since last 7hours phone switched offnowhere to be found hes in a white ignis up90p6996 he was la,
coopermunroe in todays digital age its hard to escape the screens whether you work at a computer or are just checking emails or so,
bungostrydogs info33               op ed       ,
mobile notch congress cuando todos quisieron ser el iphone x  hipeextual ,
mulegirl people arent dying outside carspeople in cars are hitting people omg the blame shifting in this country to protect ou,
micahflee if youre an iphone user who lives in china dont store any of your data in icloud instead you can still use itunes to mak,
first theres no course called computer programming secondly the language used to teach the concept of progr ,
painting the grandcanyon ,
newscantell your popular wcw story is finally out  she sleeps around with her followers last night your wcw slept with a married,
petejohansson some winter advice for brits from a canadian1 layer your clothes with a windwaterproof on top   hat2 dont dri,
t3miloluw4 behind every yahoo boy there is a jobless girl craving for iphone ,
eeeeeebeeeeeee when you drop your phone but the screen doesnt crack ,
    ,
a106kirk jackposobiec also why dont we make it illegal to own a cell phone until you are 21 because of all the deaths by texting and,
elderlansing david attentionhogg i guarantee you four nra members wouldnt have hid behind cars outside like spineless cowards while,
mrssbarnard shellmccabe belfastagmt paultyredagh81 they sure do have to say i quite enjoyed listening to diane dodds losing the ru,
pettymamii my phone be so dry i be in my settings like ooouuu what this do  ,
fremschmen mit und fr siri was ist denn das fr ein groelternspruch iphone siri timer ,
josephfrazzitta cellphonepoablehappynessanxietyusing your phone at dinner isnt just rude its also making you unhappy ,
leftatlondon theres only one rule in fight club paldont pick up the phone u kno hes only calling cuz hes dru,
sophiasexton7 my 11 year old sister took this picture of our dog on her iphone and it looks like it belongs in a magazine ,
news found by me about tech tips iphone trick store your recipes and ratios as contacts  iphone trick store you ,
hosiken  iphonesimau6ssim  ,
sincerelytumblr why u smiling at ur phone bitch cuz my bestfriend and i are funny af,
iphonemaniajp news ipad proiphone x  ,
 iphonexiphone,
master your iphone with our guide  apple is releasing the latest model of its cell operating device ios 11 later ,
turn your computer into a 24x7 money generator everyones invited ,
turn your computer into a 24x7 money generator everyones invited ,
turn your computer into a 24x7 money generator everyones invited ,
so of made me get a tear or two wonderful painting ,
turn your computer into a 24x7 money generator everyones invited ,
dralqarnee                 ,
turn your computer into a 24x7 money generator everyones invited ,
eaganpolice 360 squad video camera captures our officers typical response to an injury crash move your phone to see other areas in,
kitfm i improved adafruits nfc ring a bit was way too bulky before ,
last i heard witch hunts dont lead to plea deals and indictments five people have plead guilty yet you say the r ,
zuesvukea man every day topic 1 girls 2 sex3 booze 4 cars5 clotheshence somalians took over kasi businesses,
tictoc apple plans to release the largest iphone ever along with a less expensive model markgurman repos tictocnews ,
realdonaldtrump please admit who has the phone access to the account or at least admit its not cheeto  bc these ,
richardengel had an eyeopening question today germany banned diesel cars to protect the air so why cant us ban assault rifles to,
kojipro2015 iphonegramasiphonegilddesign iphonex ,
evildevil666 si t tjr moche au bout de 250 selfie cest rien cest le tlphone qui fonctionne mal jete le,
lmao id freak out and drop my phone on his head when he gets the door open    uk version of home alone  ,
petejohansson some winter advice for brits from a canadian1 layer your clothes with a windwaterproof on top   hat2 dont dri,
talktalk been with u guys 35 years moved house go live date today engineer came this morning still no interne ,
wow tiktok gt  ,
chpa comment vous faites les frero jai toujours une qualite diphone 5s ,
petejohansson some winter advice for brits from a canadian1 layer your clothes with a windwaterproof on top   hat2 dont dri,
moelliemoprobs dylan wow i didnt know porn was so readily available on instagram me looks over at their phone to find them watch,
skinnyyyhoney blvckngl peuttre quavec ta position et avec les pubs quil y a en ce moment ils tont directemen ,
moon to get first mobile phone network ,
florilegia mobeenakhan we have someone coming in to work tomorrow to talk to us about guide dogs shed better bring at least one ,
hinihintay ko nalang mamatay yung phone ko para matulog ako,
jimmyg i hope to share some good news tomorrow regarding the restoration process of my recently acquired apple1 computerbut in the m,
wsjtech amazon acquired doorbellmaker ring as it moves fuher into the homesecurity business  ,
abre o olho com as novinhas esto achando que se cuidar  s usar camisinha djonga ,
akuhigu can i have a promo i really wanna make more friendsim killi or lyna im 20 and i like yugioh rwby and bungou stray dogs,
27m72m poable spinning canne  pche fishing rod tlescopique en fibre de carbone ,
caithuls relative you know about computers rightme has a degree in computer science no,
sincerelytumblr why u smiling at ur phone bitch cuz my bestfriend and i are funny af,
ohmes she states in her most recent occurrence that n asked her to take off her clothes he was also holding a cell phoneshe sai,
shadesof666 gets hit by a car passerby are you okayme please i need my phoneopens twitterme lmfaooooooo yal,
flopkon wonwoo you into carshoshi it was truly a masterpiece filmwonwoo no i mean like are you a car personhoshi im a human,
wmassimonwong attended a 999 call when returning to  with pt to goto  cars had blocked us in front   back despite us parking on d,
wheeltod on phone with circushannibal im wanna ask about the jobringmaster ok so we just fire you into a net then you st,
kevintompson97 mon pre a vu mon iphone x sur la table il me demande kevin  combien las tu achet jai dis 75 il dit ok prends,
missing cdc scientist allegedly told neighbor to delete his phone number a day before disappearance ,
freiredancingto ring ding dong  shinee ,
royalairforce is it a photo or a painting  what do you think ,
bbcnwt where will people go with their dogs to have a shit and leave it there,
timaagbalaya ladies and gentlemen of the twitter community im about to get lucky through you 40k s in 15days and we all share thi,
stop the killing of dogs in mass with money from taxpayers in kazan plz sign ,
brenttoderian the most amazing thing about this absolutely amazing car commercial is that it doesnt seem to realize how effectively,
here is a suggestion ttchelps ttcnotices use your security personel and mission to ensure safety from harrassment ,
so many good dogs  ,
girlposts me i aint giving him my attention no morephone ringsme ,
lextroutman my new middle finger ring ,
drleen2             ,
pettymamii my phone be so dry i be in my settings like ooouuu what this do  ,
one day im going to have frozen playing on my computer loud enough for the kids the hear when theyre going to the ,
femigolden updated grade a uk used pricelist for the new month iphone 6 16gb 80k  64gb 95kiphone 6s 16gb 105k  64gb 125kiphon,
darrenrovell kevinolearytv ring never saw the episode or knew ring made an appearance until today like most ba ,
danielknightpl sheriff israel of broward county wasted tax payers money to put his big face on 5 police cars this guy a narcissist a,
say hello to pretty much everything voice platforms are here for your home tv cars board games   more ,
techaltar to all the android phone makers copying the notch animojis and suddenly deciding that dual cameras need to be aligned vei,
a bc senior who came frighteningly close to losing thousands of dollars to phone scammers is sharing her story ,
fishingtimeus catching a pike perch in a reservoir  fishing in autumn 2017 ,
kentfirerescue a lady had a lucky escape after entering a frozen lake in ashford in an attempt to save two dogs they had be playing,
cdietrich1007 these dogs are so freakin helpful im in love ,
download to your phone ,
lauracloustonx i ring because i cba to type ,
teddy   mister are the only dogs i have time for,
making my entire a class listen to my moody playlist because i was the fastest person to get to the computer,
benegiftgives this week were giving away a free 20 to amazon just    follow to enter contest staups fashion style musi,
mikeymashila zimbabwean genius inventor maxwell chikumbutso makes cars   other prototypes running from radio frequencies no one is te,
nevada carsonriver flyfishing repo,
jackieaina were all grownpeople have lives jobs obligations etc unless youre my man my manager or family dont expect that,
animalpenpals guskenwohy but dogs are boiled alivemillions of pigs and poultry enter scalding tanks fully conscious each year,
theanimalvines dogs are the smaest and most gullible creatures at the same time lmao ,
onlynomaly 13022818 update slaughterhouse78 dogs frm yestrescuers were not able to reach the amtthe dogs sat on the trucks fo,
i may just get this for my next phone ,
mikeysdobby adding it to my phone reminders now im so forgetful fml xx,
evildevil666 si t tjr moche au bout de 250 selfie cest rien cest le tlphone qui fonctionne mal jete le,
wonderful app dingtone for free phone calls get it here ,
deusmedibrede eu no conseguir acessar o iphone x pq minha cara eh feia,
radioheadass this guy walked by me and asked why you smiling at your phone for is he that impoant and i said yeah he is but i,
greggutfeld blink182 boycotting fedex is like a rotary phone giving up vaping ,
humzayousaf looking at our traffic cameras i can see some people getting out their cars when in standstill traffic on the motorway  d,
he aadido un vdeo a una lista de reproduccin de youtube ,
mia16495196 so sad my ifam phone is braking x singhamofficial chrisdelonge inghamfamily,
haha love it ,
dbreezy dming is basically texting so you dont need my phone number,
aditi08 my brother is missing is since last 7hours phone switched offnowhere to be found hes in a white ignis up90p6996 he was la,
bass fishing news coast to coast freshwater fishing heaven brazil peacock bass   more  the peacock bass is the m ,
the latest news from bitcoincom bitcoin blockchain crypto pr education ecosystem announces token exchange list ,
larryschweika jared kushner lost access to the presidential daily briefs pdbsits ok he can read them on cankles computer,
3frontallobe iphone,
kisschattanooga yoongismile30 btstwt i cannot deal bts has all colors shapes and sizes as fans i am living right now and you know,
kailon if you read the lyrics off of your phone then it isnt a freestyle ,
harrisramlee bagi peminat iphoneappleswitch pengedar sah produk apple di malaysia buat warehouse saleiphone 5s 16gb  hanya rm200,
yssymash we live in a world where people judge you by the size of your phone ,
darrenrovell in november 2013 jamie siminoff came on shark tank valuing his wifi enabled video doorbell at 7 million four sharks pa,
uniofoxford unlocking the worlds oldest mystery script the worlds oldest undeciphered script may soon be cracked at oxford with the,
araslanian when i say fuck the police i dont mean the police dogs,
drleen2          ,
 ,
baeredith jaime tellement pas parler au tlphone parfois on mappelle je vois le truc sonner je le regarde jusqu ce que ca cesse,
asknationwide i have nationwide home insurance emergency cover and i cant get through to nationwide on the phone ,
robdoubleyoo one more reason to eschew leather products the sickening cruelty to dogs in china govegan animalrights ,
i cannot retweet bats because i have friends end who follows me who is deathly afraid of them and i am a good perso ,
saxdan hello danny thank you for sharing your experience with us here on twitter im sorry for any delay in rec ,
katec15 i just want a husband who will play video games with me and let me have a million dogs,
bisexualjisoo my phone at 8 but my pussyfully charged ,
is there a phone number to contact twitch suppo pretty impoant  i did a quick google search and couldnt fin ,
pfineacentre fashiondesign textiles a fabric fashionweek abstracta painting ,
t3miloluw4 behind every yahoo boy there is a jobless girl craving for iphone ,
theanimalteam ,
this is why everybody is talking about ring of the cabal if you like to know all the government secrets you will ,
painting beyond painting ellen gallagher  brilliant ideas ep 10 ,
jbranb zachscotton thescore nah he killed a dude in the ring,
akuhigu can i have a promo i really wanna make more friendsim killi or lyna im 20 and i like yugioh rwby and bungou stray dogs,
oliverurso facciamo training intenso spegniamo iphone e playstation,
i was so tired last night that i fell asleep with the computer on my lap doing hw ,
harleypope  people in greenville my dogs jumped off the back of the truck somewhere around chic fil a if you see them pls let m,
theanimalvines dogs are the smaest and most gullible creatures at the same time lmao ,
wtfglfs take me 1 on 1 to go through my phone ,
        10   finger family iphone x,
nikkireediam when your all time woman crush forever buys the ring you designed for your husbands bihday ,
petejohansson some winter advice for brits from a canadian1 layer your clothes with a windwaterproof on top   hat2 dont dri,
quangoinc take a 360 viual ride in one of waymos fully driverless minivanswhich can finally make left turns   does this help,
my phone is at 4 percent,
a106kirk jackposobiec also why dont we make it illegal to own a cell phone until you are 21 because of all the deaths by texting and,
web ring was rejected by shark tank the founder asked for 700k at a 7m valuation in 2013 and it just sold to amazon for 1b,
me pwede pa addariane and mark im using my calculator why dont u use ur phoneme omg joke uneveryone laughs my corny joke,
user satisfaction refurbished device prevalence may hu future iphone sales ,
sirboo kara needs a loving furever home pls  woofwoofwednesday wednesdaywisdom adoptdontshop ,
jarrettsposts the best thing about dogs is u can act like something really good just happened and theyll instantly sta celebrating,
im a lil slow tk need to fix her phone with that mess,
3 meses com iphone 4 carregadores ,
loving long nails but being a computer person ltltlt,
davidmetcalfe12 sure it does take away some of the exploration libraries computer research but i see it as kin ,
caithuls relative you know about computers rightme has a degree in computer science no,
drleen2      20 25         1  ,
jaydepierce sometimes i hate having a phone because people feel so entitled to talk to you and if you dont reply that day it means yo,
joewil opens my computer for the first time since last night during classcomputer young nigga young nigga but im old rich self,
nohherofx ring was rejected by shark tank the founder asked for 700k at a 7m valuation in 2013 and it just sold to amazon for 1b,
thehafulco tell us about the frustrations of walking your dogs for a chance to win myherculead the only antitangle antitwist m,
chuckwoolery wow this is beautiful ,
niigoki  mihyo curling au two captains face each other for a shot at the semifinals myoui mina wants to bring a medal for japan,
tudiaproducts you can now preorder your tudia merge cases for the s9   s9plus keep your phone protected from day 1  s9 ,
debbierfischer comfo therapy dogs waiting to greet stoneman douglas kids this morning for their first day back msdstrong ,
hairy tennis ball basket dog dogs pet pets catcher tennis ball basket collector picker mouthful lol ,
shonengamez have you seen this tweet ,
conservamome make your phone your phone explore the benefits of universal unlocked smaphones bestbuy ,
itgurusatl free msi gaming computer with 1st order for business or government agency order from dell lenovo hp cisco belkin son,
arsenalfantv  ianwright0 admits ty almost made him smash up his phone after watching his interview on the weekend full vid ,
foxnews jasoninthehouse realdonaldtrump why doesnt he pick up the phone and talk to him directly sessions just ,
iphonesimandroid android sim ,
freakingtrue i just found out dogs smell germs so when they lick us they are trying to clean us and make us germ free wow we dont dese,
iphone    ,
whats it like wearing a fitness ring video ,
femalepalns did you guys know otters wag their tails like dogs when theyre happy ,
 who ,
elhelenagran check it out crisbuplen will draw doodle illustration a for you on fiverr ,
blancjosh if you diss my dogs were not friends anymore,
craigsilverman reduce patient noshows with automated reminders ehr drchrono patients doctors revcycle rcm medical healthcare,
wsjbusiness they should just stop selling firearms all together spoing goods not hunting and fishing supply  ,
kenneth0stanley kittjohnson trylks primalpoly garymarcus ilyasut deepmindai there is an entire field of research within compute,
mikeymashila zimbabwean genius inventor maxwell chikumbutso makes cars   other prototypes running from radio frequencies no one is te,
live now on wgcufms gcl were joined by saradewitt vp pbskids digital shell explain what publicmedia is l ,
nglf            21       ,
tomorrow maybe someone can leave a joke ,
aditi08 my brother is missing is since last 7hours phone switched offnowhere to be found hes in a white ignis up90p6996 he was la,
parks associates 57 of us broadband households are interested in voice control in their cars ,
pradhan funniestprank if youre using an android phone install tweet vine downloader from play store you can ,
47 dogs rescued from the dog meat trade in south korea care2 ,
fullscreennet the top 10 weirdest race cars ,
zamonjomz raise your hand if your phone is always on silent mode ,
drleen2                   21,
pollresponseprinciples computer security official paperback ,
frabjousid this is my friendhis name is abdullahi mudathir a 400l computer science student unilorinhes been declared missing sin,
chidubemo the official phone case for nigerian parents  ,
baongellman rogers is right as chief of us cyber command he needs an order from the president to conduct computer network operati,
govmikehuckabee while in taiwan this week realized how bigly realdonaldtrump appreciated here for calling president tsai on phone an,
college is likephone anime voice yugioh duel linksprofessorclassstudent sorry,
called hctra to resolve violations made from one of the companys fleet it took less than 10 mins to get someone ,
raerenyse i hate a send me pics ass niggaengage me get to know me make me like you and i will flood your phone with unadulterat,
debbierfischer comfo therapy dogs waiting to greet stoneman douglas kids this morning for their first day back msdstrong ,
karikennedyg ,
picked my ring up from being sized you cant tell me shit this ring is everything and the pictures do it no jus ,
carmellawwe  you cant even get my twitter handle right ,
nataleewould custom videos by a hot milfhappy asswednesday pov joi masturbation roleplay fetish feet waterspos humiliatio,
evildevil666 si t tjr moche au bout de 250 selfie cest rien cest le tlphone qui fonctionne mal jete le,
wow ,
