pahubb43 david hogg whats to inse himself as the poster boy for gun control and because he is a mere child and been through a mas,
menshumor dogs are simply the best ,
rickaaron problem with my iphone how do i disable the real time voicetovoice audio interface feature,
lol ,
iec3stem computer engineer and entrepreneur jasmin berry jazberri encourages girls to pursue stem look at stem as an oppounit,
christmas kids computer  top free education kids games2018 ,
marinamaral2 then there is always that recent college grad 3rd from left bottom row that cant stay off his phone,
petejohansson some winter advice for brits from a canadian1 layer your clothes with a windwaterproof on top   hat2 dont dri,
my phone always thinks my collar bones are another person ,
yashpalbjp bjp4udupi geethanjalibjp shyamalaskundar bharathimagdum udaykumarbjp mattarhegde raghupathibhat profsrk harvansh,
awesomedadgear dtmobile smashdawg janettespeyer gonzotorpedo digitaltrends that fight requires more than just ,
how a bigger apple iphone would compare to iphone x ipad note 8 ,
mrceyram when ghana girls see you with an iphone and a car ,
elderlansing david attentionhogg i guarantee you four nra members wouldnt have hid behind cars outside like spineless cowards while,
angrymelinafan wweusos vincemcmahon realmelina rubyriottwwe mickiejames bellatwins carmellawwe i am not say ,
wow ,
debbierfischer comfo therapy dogs waiting to greet stoneman douglas kids this morning for their first day back msdstrong ,
sellurre  from robot design automation to life design automation for immoality   singularity  ,
wow tiktok gt  ,
pettymamii my phone be so dry i be in my settings like ooouuu what this do  ,
pettymamii my phone be so dry i be in my settings like ooouuu what this do  ,
iphone ,
lauber46 pk liphone corrige tjr ce putain de  ta en  ya,
people are posting photos on instagram of their dogs in the snow and i am buzzing,
just reached out to a sales exec at the yankees on linkedin about joining my company his response was id have to ,
halash2    15 21          ,
rbkhetwani tinkerbell9958 aapke  phone me x likha hoghaaise batein ex hi kae hain,
liver buildings liverpool watercolor home decor design ae awork walla painting paintings ,
godhateslilphag im waiting for the day ryland forgets to take his ring off for snapchat or the vlog and we see his hand,
thewindowsclub free software to change folder icon color in windows 10  if you are an avid computer user your desktop must be full o,
razer if its not 120hz its not a gaming phoneenter the 120hzmobilemasterrace now  ,
templeegemasi my name is temple yes you read righti am a phone photographer i love to take poraits of my friends with my samsu,
thechainsmokers you need to stop complaining about your life there are people out there that are allergic to dogs,
jessiejaneduff on 911 boxcutters were violent instruments of death and tragically murdered thousands of people in just a few minute,
lauber46 pk liphone corrige tjr ce putain de  ta en  ya,
iphone  ,
i like to suck dogs cocks,
christmas kids computer  top free education kids games2018 ,
benjedwards does anybody want to buy a computer collection i have been gathering since 1993  this is less than half of it i am consi,
nice pic ,
phoneburner 8 techniques to increase your selling over the phone ,
coopermunroe in todays digital age its hard to escape the screens whether you work at a computer or are just checking emails or so,
johnboyega forgot my phone charger ,
the  fault dear sheriff lies not in the nra or our stars but in yourself  and others like you who take their sa ,
rozetked    noa  mwc 2018    n10   iphone x  n7  ,
madblackthot this hoe about to be as big as a baking sheet and im intrigued ,
dulu time phone aku hilang sedih beb banyak gambar and ic aku pun ada dalam tuspm pulak time tuuu hahahaha then ,
first attempt with watercolor pen and ink for a longlong time always hated painting  i hope ,
city hall has a few dogs found if your missing your two dogs please call us right away 3199858742,
pfineacentre fashiondesign textiles a fabric fashionweek abstracta painting ,
policemacc please stay to main roads gusts of wind are likely to cause drifts and sections of road may be blocked on minor rural road,
vice its downright disturbingpeople outside cars are dying at levels we havent seen in 25 years ,
do yall ever look at something on your phone while youre half sleep in the morning and then later in the day look ,
some remarkable stories of people stranded in cars and airpos in scotland due to snow storm on repoing scotland ,
petejohansson some winter advice for brits from a canadian1 layer your clothes with a windwaterproof on top   hat2 dont dri,
kosy pd warns of recent phone scams free story at ,
the laundry machine is humming the atmosphere is serene save the clicking of computer keys my roommate quietly a ,
smaphone market has a big contraction coming  fone ssnlf aapl sne bb ,
 luxury rich cars ,
gostei de um vdeo youtube ,
catkapow herbalinfuser rissalipstick im against all animalcruelty but in southkorea they make the animals suffer first so if th,
yo why dont we just make everything out of guns  cars made of guns buildings made of guns guns solve everything ,
kindergaeners in angela augustinis class practice identifying the value of numbers and addition by using osmo a ,
6 money making iphone apps you cant afford not to use ,
browiththefiow girls love dogs more than they love guys,
850iphone ,
institch omg its time to crossstitching on your phone,
iyinto twitter help me upgrade my iphone help me retweet  ,
enviroaction deafening air guns expanded oil and gas drilling commercial fishing in protected waters these are just some of the t,
igndeals justice league ultimate batmobile rc vehicle with 6 batman action figure for 9999 on amazon  features remote control from,
76f6a6d67617 iphonex apple iphone x1  appleiphonex iphone ,
what language do dogs think,
no one loves the dogs as much as my dad does hahahaha  ,
annazrulan aku baru tahu guna itunes and sync iphone wirelessly over wifi je no more cable needed senang gila makin mudah nak buat,
razer if its not 120hz its not a gaming phoneenter the 120hzmobilemasterrace now  ,
do your dogs have this toy if so throw it out immediately ,
seriously louistomlinson only comes online when im away from my phone the little shit,
sl6ansaif your phone,
jaime pas parler en sms avec des gens qui ont pas diphone,
me descargu un juego en el iphone de una salchicha y me tiento mucho lpm,
voy actualizar el ios ya deca yo que no era normal lo que le pasaba al iphone,
jonahnro these are good dogs ,
originalfunko    follow originalfunko for a chance to win a gamestop exclusive venompool with phone pop contestofchampions ,
gearbest smatv con wifi haier uhd de 55 8243 disponible por 395   ,
zaza9530        9500  15   1500         ,
aarondraws new cover a released by koboldpress of my painting  the diplomat ,
pettymamii my phone be so dry i be in my settings like ooouuu what this do  ,
garelllinda video  high school antigun rally turns violent5 students ages 1418 yrs old arrested why are the liberals always in,
erandyyyyv there isnt an iphone is there,
amazlngnature we dont deserve dogs  ,
pettymamii niggas be 63 with a iphone 5s looking like they holding a uno card ,
eveswellprimary we have loved writing and painting in the style of jackie morris tell me a dragon this week watercolours diaries h,
i need to get a case for my phone before st pattys ,
iochev9763 josielx33 seedsy magurkk whokares34 mikeajgriffin ap realdonaldtrump what are cars made to do,
got me and babe the iphone 8s though ,
riseandgrind up at 5am giving quotes toprated trusted professional painting ,
im feeling a touch of sad with this gloomy forecast ever wondered do cats and dogs suffer from sad as humans do ,
who knew how hard that degree in finger painting was ,
jackieaina were all grownpeople have lives jobs obligations etc unless youre my man my manager or family dont expect that,
theswprincess and then call yeah on the phone and talk to someone at their office i know who does that right you unless you wa,
i am really awkward when it comes to phone calls,
shadesof666 gets hit by a car passerby are you okayme please i need my phoneopens twitterme lmfaooooooo yal,
marcmoyer more missing cdc scientist told neighbor to erase phone number before disappearance thegreatawakening thestorm qano,
sparkdev im selling my beloved previous iphone x unfounately on 1125if anyone is interested let me know i can also throw i,
biackeverything his and hers cars ,
i think computer viruses should count as life i think it says something about uksmasecurity,
darcizzle retweet for ladies that fish marlynn with her first kingfish a 16lber pronounced marlin fishing ,
darrenrovell in november 2013 jamie siminoff came on shark tank valuing his wifi enabled video doorbell at 7 million four sharks pa,
theanimalteam i am a sensitive soul and will put 100 trust into my new mum or dad to continue to help me become more confident when,
heres everything the cia found on osama bin ladens computer although the man himself got taken out in a n ,
got in a cover to protect leather seats when riley rides in rear seat of our jeep our dogs have always gone ,
alexcerdadiaz12 me dio justo en la pobreza ,
kennethholley reddrop new sophisticated android malware spies on you steals data and racks up huge phone bill cybersecurity infose,
auccco this national eating disorders awareness week nedawareness anyone can join the conversation and help us raise awareness bu,
pejamasam jai trouv cet iphone ce weekend  vers belle pine 94 dans le tram 7 jaimerais le rendre  son propritaire merci de,
debbierfischer comfo therapy dogs waiting to greet stoneman douglas kids this morning for their first day back msdstrong ,
what are the reasons for banning oil drilling and destructive fishing in arctic waters ,
chivauk idk how to do that on the computer  but heres a pic haha ,
iphone  ,
web ring was rejected by shark tank the founder asked for 700k at a 7m valuation in 2013 and it just sold to amazon for 1b,
spoke to one of my clients mother over the phone for about 20 mins and in the process she told me i was cute and as ,
we dont deserve dogs ,
hey there ring after much researching i recently decided to buy into your ecosystem largely due to the upcoming ,
theanimalvines dogs are the smaest and most gullible creatures at the same time lmao ,
beiandernie when most of us talk to our dogs we tend to forget theyre not people julia glass quote ,
tshade1of1 if u eat hot dogs u a barbarian,
sexualgif me when my phone screen lights up and its a notification from someone i love and want to talk to all the time  ,
baqatacount    250   10     150           24  ,
petejohansson some winter advice for brits from a canadian1 layer your clothes with a windwaterproof on top   hat2 dont dri,
synthetic tourmaline hammered stacking silver ring ,
you have got to be joking or on glueand youve just insulted thousands of good alabama folk who hold him in high ,
hbiniumfin interesting technology i think in the future will be in demand for proof of authorship    ,
hmrcgovuk some of our staff   contact centres are being affected by the extreme weather today phone lines are open but busier than us,
wearescotland if you were stuck in an airpo because of the snowwould you phone stvnews  really i think id just be phonin,
emotaku17 rjuin wae da msste ich mal an den computer gehen 3,
lagunatripper wala pa ring tatalo pt 6 w kaiserdexplorereto na yung gatas na inaabangan niyo cumshot pa  ,
michigan suckerriver flyfishing repo,
devondogz imagine locking yourself in your dogs kennel just imagine well imagine no more thanks to our cornwalldogs handler pdro,
guys if my vision suddenly swipes left and right as if it was a phone and i just swiped to the next page is ,
linkedsupply its not such a dogs life with beddies comfo pet beds and toys petblanketspetbedspettoysclick this link ,
jackieaina were all grownpeople have lives jobs obligations etc unless youre my man my manager or family dont expect that,
28 off 46 stars 80 reviews 115 sold 133  windows laptop notebook computer 1920x1080 intel cherry addition ,
ntvuganda why dont these ucc chaps create an app where i can check all phone numbers  registered using my id that can help,
do we all agree that the survival of sauron was totally elronds fault he stood at the fires of mordor and let isi ,
worldpainting2 jan van eyck a painting ,
worldpainting2 gustave caillebotte a painting ,
im down to only 2 social media apps on my phone,
looking to buy a phone immediately or should i wait till march end budget within 25k rajivmakhniwait or no wait,
5d diamond painting disney princesses progress 06 make your own beautiful designs with rhinestones ,
jzipperling  und dann bittet mich meine chefin um ein pressefoto jetzt wei ich wofr sie das brauchte,
i added a video to a youtube playlist ,
debbierfischer comfo therapy dogs waiting to greet stoneman douglas kids this morning for their first day back msdstrong ,
no one discretely checks their phone while talking to someone like bethenny,
and lawyers ,
this morning i left my phone at homeits crazy how productive you can be without it  tryit,
azfamily watch live  dogs on freeway  interstate 17 nohbound at deer valley road ,
jackieaina were all grownpeople have lives jobs obligations etc unless youre my man my manager or family dont expect that,
highrhyme iphone arj uaktan daha hzl gidiyortrkhava yollar rakip km size uyann,
we are so much in sync that without a plan we have showed up in the exact same outfit im on the phone with the g ,
ncwildlife the nc wildlife resources commission will close approximately 1000 miles of hatchery suppoed trout waters to fishing o,
gerryadamssf me presenting tachta ferris with a very fine tie in appreciation of his outstanding contribution to fishing ,
familyfocusblog your phone wherever you go explore the benefits of universal unlocked smaphones bestbuy ,
lack of models not charging points holding back electric car market long waiting timesthe car industry has d ,
johnoberg pigs are extremely intelligent and can actually put together puzzles though theyre more intelligent than dogs theyre one,
freakingtrue when you drop your phone but the screen doesnt crack ,
clayenos verotruesocial clay i like you i like zack but vero as a platform is unusable right now and even whe ,
bitcoinantani giveaway win computer accessories ,
ritherdonroad aw what a cutie were a very dog friendly street all round   ritherdonroad balhamdotcom sw17 ,
pettymamii my phone be so dry i be in my settings like ooouuu what this do  ,
hannahboydx can ppl sta tweeting pics of their dogs in the snow pls thx safe to say wed all appreciate it,
girl in the sack didnt say pull out knock that lass up or pop out and paint her  im good at painting so b ,
onlynomaly 13022818 update slaughterhouse78 dogs frm yestrescuers were not able to reach the amtthe dogs sat on the trucks fo,
iphone,
lol my phone is actin real funny the time is way off,
the new apple iphone may be the biggest yet the new apple iphone may be 65 inches elizabeth ,
johnoberg pigs are extremely intelligent and can actually put together puzzles though theyre more intelligent than dogs theyre one,
jejakadeep hey my phone is a very personal thing for me so pls jangan suka hati mak bapak kau nak spot check aku punya phone withou,
davidbeeson2 good of boris johnson to list the benefits of brexittheyre about deregulationno pesky limitations on fishing the sea,
kodeinecrazy my future wife has her pinky finger on the bottom of her phone ring middle and index finger behind for suppo with he,
javalemcgee one time i told siri to twerk and my phone staed vibrating,
schoebyone good question david 3ring binders are good to go in carryon bags,
keishasfavorite i keep my phone on dnd i dont like it yelling at me to pay attention to it,
elderlansing david attentionhogg i guarantee you four nra members wouldnt have hid behind cars outside like spineless cowards while,
painting that will never be finished but has a cute irl in the corner so its okay ,
sirboo diesel is a stunning bull lurcher lad who needs a fabulous furever home could you offer him one pls   adoptdontshop woo,
dchft if you are not able to get to the hospital for your appointment due to the weather please contact us as soon as possible using t,
nwdogrescue purdie is sadly in rescue looking for a home after being used for breeding then abandoned  please enquiries via web,
exovotingsquad which one will you do with you favourite exo membera divingb hikingc fishingexol iheaawards bestfanarmy ,
tonestradamus they didnt check killmongers bih ceificate or anything they was like oh you got the tattoo and a ring say no mo,
danielhowell mimosaphil lets just say if i kept filming i would t have a phone to tweet on right now,
skinstrash throwback to tom hardys iphone case of himself at the oscars ,
mombot just remembered that time a furry said i harassed him on the computer and all i did was send him a picture of a duck ,
nightowl400 gorgeous greyhound louie has waited for a long time for his special someone to notice him he was in another rescue for 1,
pr education ecosystem announces token exchange listings and chance to win three tesla model s cars ,
baeredith jaime tellement pas parler au tlphone parfois on mappelle je vois le truc sonner je le regarde jusqu ce que ca cesse,
army dogs put down after failing to maintain standards ,
loorakennedy taking a look at the use of ring card girls in mma here are there reasons other than tradition to keep using them they,
edgybees raises 55m to bring better ar to cars and drones ,
darrenrovell in november 2013 jamie siminoff came on shark tank valuing his wifi enabled video doorbell at 7 million four sharks pa,
actionoldham we are thankful that  pcpuk have chosen us again as their charity of the year donating to us for each job done oldham,
lynneanne45 hope a loving family adopts you phoebe ,
hahaha good one david attention hogg  lmao ,
iphone ebeke ismine kendi adnz koyacak kadar ok mu seviyosunuz kendinizi,
uhhthanks ,
michaela65uk talktalk they are the worst miss understood and repeating myself for 1hour an a half on live chat ,
debbierfischer comfo therapy dogs waiting to greet stoneman douglas kids this morning for their first day back msdstrong ,
leighjalland all returned committedfosters needed and 10 foreverhomes fosters needed for urgent dogs pls go to fbcastx for,
bntteam universal 360 rotacin flexible telfono mvil tablet selfie sopoe para el cuello serpiente coche cama mo ,
 fantastic  with practice im  sure youd be able to review twitterjurys own publican covlad007 and his fine h ,
ilovemcr if you see a homeless person trying to sleep rough in tonights freezing temperatures youre urged to ring this  emergency n,
i got a splendid 6248760 points on ring of fire in fieldrunners2  have at thee ,
jonesmusara but can he use a computer asking for an older friend,
jontronshow its a shame to think how many subtle jokes get lost in iphone gt android emoji translation,
your computer is racist ,
pettymamii my phone be so dry i be in my settings like ooouuu what this do  ,
a broken phone and a broken laptop i guess it couldnt get any worse than this,
latercera por qu los fabricantes de smaphones android copiaron lo ms criticado del iphone x ,
ilizwi263 you are 29you have just asked your mum for money to buy underwear because you are jobless despite your masters from msu,
suiren retouch lt3 happy pokemon day pokemonday suiren pokemonsunmoon pokemonmoon pokemonsun nintendo ,
bucshockey you wont find this kind of deal anywhere else dollar dogs soda and popcorn bucs and the stampede join us ,
debbierfischer comfo therapy dogs waiting to greet stoneman douglas kids this morning for their first day back msdstrong ,
she could sing the phone book and i would still be amazed  ,
the iphone supply chain  ,
doseofpercocets took phone to retailer to take a look at my phone its been acting a bit weird why do you have s ,
thatoliviajones ukbtsarmation i saw icicles hanging underneath cars and snow everywhere i am glad i live in an a ,
kardashianreact me waiting for my phone to stop ringing so i can use it again ,
apologize if any are offended but if anyone is contemplating feeding your dogs or cats fancyschmancy  organic p ,
roxydavis99 how this made me feel like a virgin touched for the very first time like a virrrrgiiin when your hea beats next to,
theeconomist for the younguns a notebook is not a computer  its pieces of paper bunched together   sandwiched ,
govmikehuckabee while in taiwan this week realized how bigly realdonaldtrump appreciated here for calling president tsai on phone an,
baddiesuk  baddies crown ring the one ring that will rule them out get yours on ,
ring there is no more sound over the ring app on my android phone cant hear anything and people on the other end cant hear me,
my phone shut down right after i tweeted this  what does that mean ,
lauber46 pk liphone corrige tjr ce putain de  ta en  ya,
johnoberg pigs are extremely intelligent and can actually put together puzzles though theyre more intelligent than dogs theyre one,
chillontommy when he hitting it from the back and you hear his phone unlock  ,
mombot just remembered that time a furry said i harassed him on the computer and all i did was send him a picture of a duck ,
kontaminie saatchi a astrid 7 drawing by skip rohde a installation sculpture painting drawing contemporarya conceptua,
jackieaina were all grownpeople have lives jobs obligations etc unless youre my man my manager or family dont expect that,
pettymamii my phone be so dry i be in my settings like ooouuu what this do  ,
jackieaina were all grownpeople have lives jobs obligations etc unless youre my man my manager or family dont expect that,
graysondolan trying to talk to ethan while hes on his phone is like trying to talk to a brick wall while its on its phone,
gordperks today many people on toronto twitter areasking themselves should we be surprised that there are families without cars con,
drjohnm post afablation ecg below doc i feel great im swimming and walking and i have my life back tell me we dont need a sh,
if anyone is looking to sell an iphone 6s or newer let me know i need a new phone,
jackieaina were all grownpeople have lives jobs obligations etc unless youre my man my manager or family dont expect that,
kessegh when a married man wants to have sex with you hell tell you about his marital problems paint his wife as a bad woman prom,
kenxyro perfectlegend ring matches are finally working for me so thats goodi still cant join populated lobbies so imma guess other,
ford selfdriving cars are delivering pizzas across miami  ,
estellehitchon please consider how you use our emergency health services and make sure youre sensible as we need to preserve our prec,
german cou says cities can ban diesel cars ,
today i nearly left my brand new iphone 7 in a public bathroom ,
raykamba when your life is wohless and even the dogs know it what a waste this human is  ,
iceshadow029 mdr ton iphone 8 il est tellement prcis jai limpression jarrive  sentir lodeur du nouveau de ton pull ,
streetvetuk we are out again tonight to do our regular camden run with pals from streetskitchen refugeeckitchen they will dish up t,
calott johnosborne1979 seattlesubway byrosenberg uber will also get people to rent cars through them those c ,
liberalgoddess jamesdoss50 chestnutt1975 realdonaldtrump its not legal to take the unsubstantiated results  ,
savmarie85 computer screen goes blank in classprofessor can someone go move the mouseclass stares blankly around the roomprof,
lets waste time chasing cars around our heads i need your grace to remind me to find my own,
rome to ban diesel cars from city centre by 2024 c40cities100rescities,
fspielman have you ever been to cacc a battalion of volunteers walks dogs daily this guy spouts off knowing you ,
funny dogs  a cute and funniest puppy videos compilation 3 ,
cdietrich1007 these dogs are so freakin helpful im in love ,
transrightsmove lets keep an eye on dicks spoing goods stock over the coming days  guessing they will get a healthy lift  i kno,
i improved adafruits nfc ring a bit was way too bulky before ,
debbierfischer comfo therapy dogs waiting to greet stoneman douglas kids this morning for their first day back msdstrong ,
exoticsracingla sundays are for super cars and we want to make sure ours get pampered with a nice detailing and a wax which car do yo,
my phone be soooo daaaammmnnnn drrrrryyyyyy,
meda fuck    ,
i useta think it was for people that refused to adapt with the touchtone phone craze lol ,
oh no ,
the dogs full on snoring her head off and its so cute and so annoying at the same time,
caithuls relative you know about computers rightme has a degree in computer science no,
dogs are furry angels ,
lolameup your stove is on fire   you took your phone out to record ok,
aditi08 my brother is missing is since last 7hours phone switched offnowhere to be found hes in a white ignis up90p6996 he was la,
dstvkenya my phone number is 0705840077 and 0720369085 and my router number is 0774971089imei no357243079686510 ,
gtmcknight why pinterest shouldnt be lumped into same basket as fb youtube snapchat etcwe want to be a company that encourages,
browiththefiow girls love dogs more than they love guys,
realdonaldtrump pretty classy doing this on twitter look up sessions phone extension in the guhment phone direc ,
djp1016 i love my dog but i also love other peoples dogs even if i dont know them,
joshinsights nba fade the public systemdogs getting 35 or less bets and 35 or less dollars w 2point inflated line or more53,
aditi08 my brother is missing is since last 7hours phone switched offnowhere to be found hes in a white ignis up90p6996 he was la,
