twspk thanks for your constant suppo  founately i have counted on the help of three very sweet people who h ,
my ringtone is currently the skins gen 2 theme song and has been so for over five years ,
iphoneor galaxy    both ,
amazingphil danielhowell did he mess your phone camera up,
amsterdam  canal  palette knife oil painting on canvas by leonid afremov ,
na pobreza j me adaptei ao hbito ,
rain alarm xt se actualiza ofreciendo sopoe al iphone x ,
jessicajones cant come to the phone right now or ever ,
bangripiu yak iphone x ini emang fenomenal desainnya banyak jadi panutan ibarat jadi orang paling keren pasti banyak wannabenya,
mrmalky according to transpo scotlandthere are eejits who drove on closed roads and had to abandon their cars2 eejitsall main roa,
sharkan on ma demand comment je faisais mon painting du coup voici un speed a pour rpondre  cette question jai peur que le s,
pettymamii my phone be so dry i be in my settings like ooouuu what this do  ,
catchlutte jeff hardy a repris les entranements en vue dun retour sur le ring wwe,
j5wpm5pneftpayf              ,
how to compose with telephoto camera on iphone  apple ,
the chaos of unlocking your phone in 2018fingerprints voices faces eyes double fingerprints ,
the best thing ive done for myself this month is buy a 6 ft charger for my phone,
darrenrovell in november 2013 jamie siminoff came on shark tank valuing his wifi enabled video doorbell at 7 million four sharks pa,
tescoirl aoifekat i have been waiting for my order since 2 pm i didnt receive so much is a phone call regardin ,
ta1bgdm  033359969  10091178 twitter for iphone,
huaweideviceusa he didnt tried iphone x,
femigolden you have that phone or laptop you want to sell hit me up lets get you a buyer and sell immediately pls  my customer,
new post pr education ecosystem announces token exchange listings and chance to win three tesla model s cars ,
zantestrays clever little liam followed the sound of happy dogs   found our foster home hes a very social little boy who loves peop,
bungosdanime info33oped,
ozy14uzk  033400426 0424 1751178 twitter for iphone,
itsrupaulryan i think ive only ever been in a dicks spoing goods once i am not an athletic person but rest assured that i will g,
cheating i cant wait to have a husband my own husband a man thats mine for life he a whole husband he put a ring on he deadas,
toys r us and maplin never been in either and global pressure and online is the only place most buy nowa few will ,
albemohler do dogs feel guilt what the doctrine of creation tells us about our pets thebriefing ,
aditi08 my brother is missing is since last 7hours phone switched offnowhere to be found hes in a white ignis up90p6996 he was la,
popped a tirebent a rim shattered my phone screen having a great week,
ninjanaruto iphone naruto anime manga naruto all new wallpapers with calendar ,
beautybrite make your phone truly your phone explore the benefits of universal unlocked smaphones bestbuy ,
debbierfischer comfo therapy dogs waiting to greet stoneman douglas kids this morning for their first day back msdstrong ,
lordwinkins id blow the brains out my dog tbh 50 mil can get me 1000 dogs lol,
debbierfischer comfo therapy dogs waiting to greet stoneman douglas kids this morning for their first day back msdstrong ,
policemacc we have had repos of antisocial behaviour involving snowballs please note throwing snowballs at cars  and with stones,
pettymamii my phone be so dry i be in my settings like ooouuu what this do  ,
rain alarm xt se actualiza ofreciendo sopoe al iphone x ,
cb618444 call dicks spoing goods to let them know what you think about their cowardice 8778469997 ,
i cannot wait to get back in the ring,
darrenrovell in november 2013 jamie siminoff came on shark tank valuing his wifi enabled video doorbell at 7 million four sharks pa,
ysfmohamad elissakh my new cover phone  ,
johnboyega forgot my phone charger ,
philippereines dude why not use the phone ,
jackieaina were all grownpeople have lives jobs obligations etc unless youre my man my manager or family dont expect that,
infosfuteboi um dia cristiano jr me pediu um iphone no dei queria mostrar a ele que nem tudo que queremos  fcil conseguir ele,
thefblife when your girl takes your phone and tries to run  ,
patcarlson50 stevescalise no maam they do not blame any other tool used in homicides other than guns please sho ,
avec ses ar emojis le galaxy s9 faitil aussi bien que liphone x   ,
jackieaina were all grownpeople have lives jobs obligations etc unless youre my man my manager or family dont expect that,
talk to your mom and say what  your mom hai chill guys im dating you not your mom ,
gembest i really do not understand why people are still snapchatting   videoing the snow whilst driving weve all seen it  is it,
chillontommy when he hitting it from the back and you hear his phone unlock  ,
trafficscotland  please do not walk your dogs on the motorwayseven if traffic appears to be at a standstill,
cool i love it when my phone breaks amazing,
334ranker 38ak  033402432 2430 4281178 twitter for iphone,
duncanjwatts computational social science  computer science   social data ,
iphone ,
 ring jannedaarc,
amyperuana overlooki sellittimr luciatassan papryka5 scastaldi9 asamsakti henrirouen agustingut paoloigna1 emanuelaneri14,
i dont see the problem ,
my phone passed away yesterday if you need me email or pm me here,
invegewetrust hi alexander thats the right number but the lines are busier than usual as theyre operating a red ,
had a great day painting with my bud dexter astagram creative asy ,
madblackthot oh come on wig ,
charliespiering we are reminded that america is a nation sustained by prayer realdonaldtrump said during billy graham tribute poin,
my phone charger is almost broken and dead and i dont have any others great,
benstarspos thank you for the aicle in todays rpgreyhounds  lets do all we can to keep the dogs on sky  towcestertv bruc,
the gun owners i know have never bought a gun from dickstbh i only shop there for soccer equipment and fishing g ,
sheryarbhagat still you are thinking that who will own you so dont think and just open your phone and register yourself as the member,
official twitter tool to download on your phone ,
nizmycuba because of tv schools and liberal teachers has emerged in america a generation of idiots who dont know what communism is n,
kodeinecrazy my future wife has her pinky finger on the bottom of her phone ring middle and index finger behind for suppo with he,
mrbillstunes au5music just bought your latest work from itunes  but austins name doesnt show up anywhere wh ,
pawtitions this dog barely survived this vicious attack now were demanding justice ,
muaythaibologna nocorsi  un posto serio dove imparare veramente specializzati in spo da ring e gabbia tutti info al club 15,
iphone  ,
learn the fascinating history of the classic british spos car ,
als31  when you spot the iphone ,
nrszwn tak baik ketawa kan because i know how it feel ah paiseh gila cuba kene kat krg baru krg tau step main phone pdahal scroll ti,
truefactsstated i spoke to a source i hadnt spoken with in months wed had a bit of a falling out not badi mean they did pick up t,
kevinfarzad secrets to success wake up   check your phone for 40 minutes before getting out of bed whenever you park check your,
my mom talking bout i cant take my car to school with me next year thats was the whole reason of finding school ,
my 2nd phone in the back yard in a chip bag under the lawnmower cause i know she definitely not finna cut no grass ,
 ,
onelondonco follow   retweet to win this apple iphone x 256gb giveawayends 28218 competition iphonex ,
gadgetstouse oneplus 6 leaked images reveal iphone x like notch and dual cameras ,
thelamaja fam we might need to do a discussion on this monique situation with like minded people on a phone confer ,
maryalexcorley kimberarias adobepremiere there are companies that will rent out their server space to process vi ,
takeobentuyo take 033405463 5461 5691178 twitter for iphone,
stephenathome i wonder if maybe its because cars kill more than rifles do its just a thought,
cgguy44 me i aint giving him my attention no morephone ringsme ,
pandorasuppo my iphone and pls thatd be dope,
334ranker rouninfriends  033359934  10211178 twitter for iphone,
pettymamii my phone be so dry i be in my settings like ooouuu what this do  ,
anico  033402351 2349 4261178 twitter for iphone,
my tl is full of happy wonho bihday wishes and i am smiling like a creep to my phone in public happy bihday ba ,
befltmotlvation im obsessed with this ring  ,
joshinsights collegehoops contrarian system road conference dogs 12 or more getting 25 or less bets259183 ats 586 6336,
debbierfischer comfo therapy dogs waiting to greet stoneman douglas kids this morning for their first day back msdstrong ,
kateday oops  ,
ceraminic cute feather design at my etsy shop feather porcelain ring dish black white ceramic plate henna inspired jewelry dish t,
im amazed people this stupid can even work the phone in the first place ,
amazon buys video doorbell company ring ,
iphone  ,
been using the same phone for 5 years i forgot how it feels to have a new phone smh jes,
drawing making you withdraw painting have you panting more nonos than photos call and ask for advice on your pr ,
 ,
jaydepierce sometimes i hate having a phone because people feel so entitled to talk to you and if you dont reply that day it means yo,
mrjafri youandigotogetherlike a millennial and their cell phone ,
lego ideas old fishing store 2017 21310 ebay ,
leder magnetic flip cover iphone 7 plus in bern kaufen bei ,
rpetrich hi i would like to purchase little brother tweak it runs  very well on my g0blined iphone se on ios 1 ,
nade45  033422860 22858 8721178 twitter for iphone,
pettymamii my phone be so dry i be in my settings like ooouuu what this do  ,
my tamagotchi forever sar disponibile a breve su app store ,
amyperuana geminicat7 69quietgirl biagio960 yebosfaye ritamay1 sir lawrence almatadema 1836  1912 born in dronrijp the nethe,
this ,
dogs ,
zaswv3         0505912355,
nonfictionboy result  033402503 top2501rank  435  1178client  twitter for iphone,
glamourgoais  to win iphone x 256gb in silver must be following me to enter ,
cualquiera con un iphone x sale lindito en sus fotos,
befltmotlvation obsessed with this ring  ,
dogs,
ipadiphone,
wonderful app dingtone for free phone calls happylohri travel,
crazyhorse2126 sitting bull inside of me there are two dogs one is mean and evil and the other is good ,
aditi08 my brother is missing is since last 7hours phone switched offnowhere to be found hes in a white ignis up90p6996 he was la,
darkenedamypond she walks into her pub smiling looking around typing her number in her phone,
noureshkaa les gars qui chipotent  leurs tlphone alors quils ont aucune notification sauf celle des rglages qui vous prvient qu,
pettymamii niggas be 63 with a iphone 5s looking like they holding a uno card ,
ichris zcichy the excitement and wonder jobs put on when demoing imovie garageband idvd pour one out etc all opened up what was,
simiphonesim,
bobbyllew well im impressed i never expected to see this in february in the uk and remember we are also charging 2 electric cars,
geluni result  033400105 top0103rank  65  1178client  twitter for iphone,
razer if its not 120hz its not a gaming phoneenter the 120hzmobilemasterrace now  ,
cheating i cant wait to have a husband my own husband a man thats mine for life he a whole husband he put a ring on he deadas,
pr education ecosystem announces token exchange listings and chance to win three tesla model s cars buzzeology ,
pinguimzingamer meu celular  iphone anjo,
mcuban congrats jamie  always a beautiful thing when an entrepreneur succeeds  way to ring the amazon bell theamericandream ,
lejuancah make me you are the only person who can i contact but phone still not sure about that one of my friends ,
passionegrecia  la magica isola di hydra dove le auto non circolano the magic island of hydra where the cars do not circulate,
samwalker0151 caseyljackson the fact he is just sat there on his phone like a normal guy she looks evil and po ,
circa ford has begun testing selfdriving cars in miami ,
hailkayode this is the new model of a transmission shifter in automatic carsyoud be trying to increase your radio volume and find,
homeowner tells us the assistant fire chief of stroud township saved one of her dogs for the second time this is t ,
ok i had a missed call from a phone number that doesnt exist because it is only six digits long i am so confused,
originalfunko    follow originalfunko for a chance to win a gamestop exclusive venompool with phone pop contestofchampions ,
zaswv3        ,
crieslnvain la gente que conozco que tiene iphone x lo ms que hacen son fotos frente a espejos aydenlos ya mismo y dganles que est,
kiyomizubts mrmathieuxd 60fps lcran de liphone x est qhd aussi cest pratiquement le mme que le s8,
jackieaina were all grownpeople have lives jobs obligations etc unless youre my man my manager or family dont expect that,
imagine biting into an onion ring and it not crunching,
merepetlahkau history phone kawan wak saat ni ya allah kau berilah beliau kekuatan untuk jalani dugaan ini ,
frabjousid this is my friendhis name is abdullahi mudathir a 400l computer science student unilorinhes been declared missing sin,
iphoneandroid ,
parkermolloy ,
jimbourke edgybees raises 55m to bring better ar to cars and drones ,
najouz en fait ctait sa copine depuis 2 ans et demi elle tait effondre je prcise et jinsiste nous toutes on rigolaient au,
i was really sleepin on this phone ,
petejohansson some winter advice for brits from a canadian1 layer your clothes with a windwaterproof on top   hat2 dont dri,
i want to block my ex so bad this bitch stay sending streaks to my phone,
tune in  popandrockmusic   nradioapp   ,
334ranker 46bu  033400011 0009 61178 twitter for iphone,
natashaletioa pit bulls are killers pit bulls are the most dangerous dogs dont let your kids around pit bulls pit bulls are,
jaquan makes me so mad to the point where i be ready to ring his neck ,
iphone    ,
greggutfeld blink182 boycotting fedex is like a rotary phone giving up vaping ,
suminong im using iph5 right now no calar or smtg it been 7 months since my dad bought it for me i wasnt in ru ,
debouderah le correcteur iphone il devient trop indpendant un jour jvais crire dsl cest le correcteur il va changer en me ba,
 ,
cb618444 call dicks spoing goods to let them know what you think about their cowardice 8778469997 ,
instigators turn bitch in cageslet loose and bit the neighborswrist to razorsyall dont want war you wan ,
johnboyega forgot my phone charger ,
silver ring letter k initial ring sterling silver initial ring ,
tai is the reason my phone doesnt charge she takes it off and takes pictures of sht all night,
hobbycraftabd horrible weather in aberdeen if escaping to a tropical island is not possible why not get the next best thing a t,
rouninsaikyou  033400680 0678 2361178 twitter for iphone,
gibson2484 pattymo anyone who makes the guns are deadlier than cars argument is a grade a dipshit,
aditi08 my brother is missing is since last 7hours phone switched offnowhere to be found hes in a white ignis up90p6996 he was la,
i17 nohbound at pinnacle peak traffic is moving slowly as dps tries to herd two dogs safely off the highway ,
hulusuppo didnt help cant just sit on hold on the phone for 20 minutes waiting to speak with someone though ,
pr education ecosystem announces token exchange listings and chance to win three tesla model s cars buzzeology ,
abc15 dog chase dps following dogs on i17deer valley in phoenix watch live ,
iphone6iphone6plus 1cashback2cashback 3cashback  0353414370 mnp iphone   ,
hancaitttt i have this really bad habit of opening text messages on my apple watch   not replying so then i forget to reply from my,
                 ,
top 5 cameraphone ,
jackson48681198  033400198 0196 1101178 twitter for iphone,
ceraminic cute feather design at my etsy shop feather porcelain ring dish black white ceramic plate henna inspired jewelry dish t,
fufythemba youhaventlivedifyou havent transferred aiime from you elders phone to your phone and delete the messages ,
hyungwonope  there isnt one moment where i didnt think of monbebe wonho always wore any bracelet ring or necklace that was carved,
official twitter tool to download on your phone ,
rvseulgitrans yeri where do you wanna sleepseulgi  yeri lmao she gave me an eye smile choose one pd you can do night fi,
10 iphone x jajajajajaja ,
too late cc prettylawbelle ,
mcuban congrats jamie  always a beautiful thing when an entrepreneur succeeds  way to ring the amazon bell theamericandream ,
jumianigeria why do you get a new phone jumiamobileweekvote and   ,
cnet bababababanana phone  ,
everyone cloning a shit design why,
petejohansson some winter advice for brits from a canadian1 layer your clothes with a windwaterproof on top   hat2 dont dri,
elizabeth i message in aring ,
vivisantii heres a selfie of me and my ring  because i dont know how to act without showing it off  ,
gossiproomoff la belle ville de san francisco  travers lobjectif dun iphone x  ,
on sale 746 english bulldog carmagnet bumpersticker dogcelebration  waytooviral   dogs  bestofbulldogs ,
yaminoma81  033400555 0553 2041178 twitter for iphone,
jrhodespianist this painting of me by the brilliant charliemackesy wow just wow thank you charlie xx ,
lunaluvgood2017 wow amazing stand by dicks spoing goods i am sure they are getting some flack but i think we should send ceo e,
a106kirk jackposobiec also why dont we make it illegal to own a cell phone until you are 21 because of all the deaths by texting and,
when i was younger i thought flying cars would be a normal thing in 2018 here we are in 2018 ,
danielhowell mimosaphil lets just say if i kept filming i would t have a phone to tweet on right now,
eerste keer in mn iphone x leven dat ie aangeeft nog 20 batterij ovet,
first thing i do when i feel jarred is ring my big sisters genuinely wouldnt know what to do without them,
pit bulls are aggressive and vicious you need to be careful with him dont let him around other dogs well my dog ,
citrine cabochon ring ,
dodylukas awas intelejen,
sma phone sales are dropping and feature phones are coming back worldwide im honestly super over being tracked ,
benjedwards does anybody want to buy a computer collection i have been gathering since 1993  this is less than half of it i am consi,
free audio book by gryndhousz f what you heard lifelove   self evaluation for women with common sensenot ,
roadtriptv you could slide into my dms i can make your night very interesting i can show you pictures of my dogs,
petejohansson some winter advice for brits from a canadian1 layer your clothes with a windwaterproof on top   hat2 dont dri,
debbierfischer comfo therapy dogs waiting to greet stoneman douglas kids this morning for their first day back msdstrong ,
pettymamii my phone be so dry i be in my settings like ooouuu what this do  ,
houseibotti  033400818 0816 2611178 twitter for iphone,
find your iphone but for apple tv remotes please immediately ive had enough,
3ideraven dear billgatesif you can blame cryptocurrency on deaths resulting from the purchase of fentanyl on the dark web can we,
driverless cars 90 percent done 90 percent left to go ,
boyfriend plug your phone inme no im listening to want you back on repeat until it dies5sos wantyouback,
underscorejo wasthatatire maxxsio my phone autocorrected fight me,
what moves the most peoplenot cars automated vehicles cant save cities ,
web ring was rejected by shark tank the founder asked for 700k at a 7m valuation in 2013 and it just sold to amazon for 1b,
iphone  ,
riconastyy nigga its 4am  give it a rest ,
duplaselton somebody get tearsforfears on the phone,
lol imperial have invited a prince who has a private jet and a fleet of luxury gas guzzling cars to give a speech o ,
callmereelax talk to my mom yal need to chill its not that deep its just dating ,
zaswv3         ,
i dropped my phone andstopped beathing,
a lot people starve to have an iphonejux to take nice picsbt if ure uglyure uglyuntil u get rich or undergo plastic surgery,
the people who preach that they should have been taught about taxes oil changes and other necessary things to kn ,
mikko interesting point raised in a reddit threadsatoshis original bitcoins are now a quantum canary once we see them moving we,
margaretkaine hodder have reissued ring of claymy debut novel which won two major awardswith a stunning new coverat the moment,
shout out to coldnyte for making my phone auto correct cold to always be capitalized clearly there is no other use of the word ,
tansyohok  033227855  11741178 twitter for iphone,
kevinfarzad secrets to success wake up   check your phone for 40 minutes before getting out of bed whenever you park check your,
download on your phone ,
rhiandoy omg i would so do it if my other 2 dogs would allow it ,
better be these prices when im ready to buy oh  ,
restinijm everything points to tesla still only making about 1000 cars a week and it is the last day of february ,
bsostrom transitions 18x24design a painting awork ,
jackieaina were all grownpeople have lives jobs obligations etc unless youre my man my manager or family dont expect that,
avec ses ar emojis le galaxy s9 faitil aussi bien que liphone x   ,
ameliarobinson0 u actually think im joking aswell like nobody hus my fucking dogs like just no one  there my bloody life,
thank dang man racing is weird ,
theellenshow jimmykimmel his iphone shows a new text message ill see you tonight at 630 pm well meet at the ,
shannonairpo  attention passengersarriving passengers returning to their cars parked at shannon airpo can avail of our free,
abybenhigbie 1st pics my oilpainting2nds the original photographmsgme4 affordablea canvaspaintings painting porait po,
numariboutique get her a princess ring because shes your princess shop now ,
pettymamii my phone be so dry i be in my settings like ooouuu what this do  ,
highlunatic contemporary self porait painting final project ,
cdiphone,
raspberrymoons this crashed my phone but it was woh it,
debbierfischer comfo therapy dogs waiting to greet stoneman douglas kids this morning for their first day back msdstrong ,
thewindowsclub free software to change folder icon color in windows 10  if you are an avid computer user your desktop must be full o,
i just published carolee schneemann kinetic painting at moma ps1 ,
shes currently sitting on a bench watching dogs walk bye ,
ragways tarekfatah sayehhassan just like cars are driven by people who know how to drive them without killing people unhrc also sho,
gdad1 plz  adorable little dodger peconic ny this poor sweetheas been waiting 10 years for a loving home 10 years  lets,
i am on android and windows 10 but my phone is not syncing at all  galaxy note 8 smn950u android version 711 at t,
very strange it makes me hold a lot of conflicting ideas and emotions in my head at onceoh i just thought of so ,
juddapatow 500 dollars a year to be a security guards too who wouldnt want to train for and take on all that responsibility and li,
abc15 dog chase dps following dogs on i17deer valley in phoenix watch live ,
im using activatorapp to add customizable gestures and shocuts to my iphone,
leahparker loving my high   low mountain ring from ,
eamt ring 020787860 ,
clintfalin dogs are the smaest and most gullible creatures at the same time lmao ,
le tlphone deugnie une vrai commre ptn,
chieshadownaka hey just found this tweet from 8 years ago that i tweeted from my flip phone that had a signature which i changed ever,
debbierfischer comfo therapy dogs waiting to greet stoneman douglas kids this morning for their first day back msdstrong ,
pettymamii my phone be so dry i be in my settings like ooouuu what this do  ,
zaswv3           ,
iphone    ,
anthonyhaglauer wed like to help out heres more info on temperatures with your iphone ,
my phone is dumbit staed randomly playing good grief from across the room its still over there and its still playing,
seedsy magurkk whokares34 iochev9763 mikeajgriffin ap realdonaldtrump we do take cars away from people who carelessly or delib,
notevansposts my fbi agent is on their game today my classmate gave me a piece of gum and boomscrolled down on instagram and there,
amyperuana clanlupi dianadep1 simonjetz jaoreror menkareh montgutz agustingut juande4u famainez2001 1atsuhimerose2 bperr,
naochisato  033454722 54720 9791178 twitter for iphone,
hahahamza20 when someone plugsoff your cell phone from charging  ,
amazingphil danielhowell how were you holding your phone without gloves,
blockada is the best adblocker ive ever used on android tvphone  this thing swipes everything,
haelll my phone b on dnd i am not declining ur calls,
jaydepierce sometimes i hate having a phone because people feel so entitled to talk to you and if you dont reply that day it means yo,
missing cdc employee was denied promotion told neighbor to delete phone number repos say via the foxnews app ,
brandpost your iphone has everything in it how do you protect that information ,
cardozagab if you look at starbucks lst 2 quaers repeat attendance has been down which has prompted an increase ,
danielhowell mimosaphil lets just say if i kept filming i would t have a phone to tweet on right now,
my phone been freezing up bad since yesterday pressing the home or power button doesnt help either ,
ceraminic cute feather design at my etsy shop feather porcelain ring dish black white ceramic plate henna inspired jewelry dish t,
tried using the speech to text app on my phone to create a script for my presentation and i think i may of briefly ,
pr education ecosystem announces token exchange listings and chance to win three tesla model s cars buzzeology ,
baesmashsa i dont have aiime  plus my phone hasnt had network since yesterday im sure she has tried callin ,
