mariangelasant8 amyperuana overlooki sellittimr casalettori luciatassan papryka5 scastaldi9 asamsakti henrirouen agustingu,
this guy keeps pacing around my desk while hes on the phone and its giving me anxiety ,
mariangelasant8 amyperuana overlooki sellittimr casalettori luciatassan papryka5 scastaldi9 asamsakti henrirouen agustingu,
barstoolspos ring just sold to amazon for 1 billion dollars shark tank passed on it in 2013 for a 7 million valuation,
pejamasam jai trouv cet iphone ce weekend  vers belle pine 94 dans le tram 7 jaimerais le rendre  son propritaire merci de,
wonderful news  germany here we come with our bio fuels   steam ,
akbais i am kovidh vegesna i came to the us as a child legally im turning 21 soon i wont be able to become a computer scientist,
mariangelasant8 amyperuana overlooki sellittimr casalettori luciatassan papryka5 scastaldi9 asamsakti henrirouen agustingu,
jaydepierce sometimes i hate having a phone because people feel so entitled to talk to you and if you dont reply that day it means yo,
 let sleeping dogs lie  spooky,
drcharliem the team were so shocked that a doctor answered a ringing phone on the ward that they gave me a sticker anyonecananswer,
karlinsatu winter comethandrew alan johnson a painting nature winter ,
louistomlinson lt tour 2018 doesnt that ring any bell ,
weve added nohern impressionist and at times stunningly accurate photo realist richard gray to our site go c ,
pettymamii my phone be so dry i be in my settings like ooouuu what this do  ,
gooddogmagazine is your dog feeling cheeky these days or did you just adopt a puppy that you cant control  check out these tips for,
porsche and xain testing iot ai blockchain technology solutions for sma cars ,
iphone   w   ,
ruthmen 2bkilled 0228 nyc dogs 2b adopt pledge foster or rescue ,
top3apps for 28ubatta iyikiakenervardtwitter for android 64twitter for iphone 30twitter web client 4,
those 3 firearms owners should be automatically charged with child endangerment and no longer have the ability to o ,
marymaryyubuggn wow i hope that my phone is water proof because i am drowning over all them pop tas we have ,
iphone,
depoes la caelera superfly2 despe en romn gonzlez la ambicin de antao y su afn por ser el mejor ahor ,
trump has tweeted from his iphone staing at a small bible school in florida billy,
jaydepierce sometimes i hate having a phone because people feel so entitled to talk to you and if you dont reply that day it means yo,
rgvjrr 5k retweets   codymcqueen will switch from samsung to iphone ,
noladarling84 im just not into doing domestic shit for men while im ringless and no i will not be auditioning for said ring you w,
chidubemo the official phone case for nigerian parents  ,
douglasernst yes because one cant possibly engage in scarfing hot dogs on the fouh of july without being co ,
digiconacademy this is truly impressive to teach digital without digital tools bravo ,
wifi endoskopkamera kabellos inspektionskamera 20 megapixel 720p hd endoskop ip67 wasserdichte snake kamera mit ,
zishbabybob when you visit a sangoma firstly ask  for your phones password if he gets it rightthen you can discuss your problems,
vem criar parceria com bolt ,
drop am as e dey hot  youve reached 1500 s already ,
galaxy s9 deal bring the phone to us mobile and save 200  cnet ,
iweekouatch rdv  20h pour la rediff de lmission dhier soir avec jcvignes fanchy56 et benjaminvincent au sommaire  liphone x,
iphone    ,
memeprovider 1980i bet there will be flying cars in the future2017 ,
burnie i dont have an iphone i absolve myself of guilt,
svlcvst san francisco california through the lens of an iphone x ,
emmablackery a few moments after i took this i tried to close the fake septum ring up so it wouldnt m fall out and well now i have,
javiermalagon could this old ad be copenhagenize s favourite car commercial ever its not often you see them accepting that cars ar,
diskon promosi lazada promo iphone fair diskon hingga 10 ,
debbierfischer comfo therapy dogs waiting to greet stoneman douglas kids this morning for their first day back msdstrong ,
debbierfischer comfo therapy dogs waiting to greet stoneman douglas kids this morning for their first day back msdstrong ,
omg wie toll eine urbane stadt sein kann  ,
honestly i can only hope my husband listens to details as well as my fbi agent in my phone,
debbierfischer comfo therapy dogs waiting to greet stoneman douglas kids this morning for their first day back msdstrong ,
vv2a          10 15  21      ,
thebestroasts iphone vs android ,
kimberly1999 pics of everyones dogs in the snow is making me wish i was home with ma own dog so much ,
danvil3351 which dog i can see why you might think that my dogs are absolute stunners,
kardashianreact me waiting for my phone to stop ringing so i can use it again ,
hyungwonope  there isnt one moment where i didnt think of monbebe wonho always wore any bracelet ring or necklace that was carved,
good to know  these are the best sofa fabrics for you and your furry friend to snuggle on poshpethotel pph ,
lol i wont even message you to ask why you called  ,
join me at the top of the hour for your hump day lobotomy the hump day kiss song for dayanyway you slice it ,
see this wonderfully playful painting created by a local student at our opening reception for youth a month yam ,
ferrari allowed dealers to roll back odometers on used cars ,
jaydepierce sometimes i hate having a phone because people feel so entitled to talk to you and if you dont reply that day it means yo,
varcrypttokensale ,
futumalshamri    12  15   21    ,
ar emoji vs animojis comparativa la otra guerra entre galaxy s9 y iphone x ,
is it wrong that we  this selfdrivingcarfail mwc18 ,
never fall asleep and leave someone with your phone theyll sta tweeting like its you  i don ,
so several cars behind me were stuck sitting here behind this utter pillock whilst he delivered stuff to ,
petejohansson some winter advice for brits from a canadian1 layer your clothes with a windwaterproof on top   hat2 dont dri,
principalmsd this was just one of many photos taken today thanks to the therapy dogs they have been a major source of healing for my,
chinese ass cream saves me burning ring,
cars yeah ,
rands those home screens give absolutely facinating insights at the huge variety of how and what for people use their phone,
mobile notch congress cuando todos quisieron ser el iphone x ,
best boost mobile deals,
missing cdc scientist told neighbor to erase phone number before disappearance ,
jackieaina were all grownpeople have lives jobs obligations etc unless youre my man my manager or family dont expect that,
tmfansuppo done fyi i had no problems accessing the website from this same computer yesterday,
infosfuteboi um dia cristiano jr me pediu um iphone no dei queria mostrar a ele que nem tudo que queremos  fcil conseguir ele,
ar emoji vs animojis comparativa la otra guerra entre galaxy s9 y iphone x ,
petejohansson some winter advice for brits from a canadian1 layer your clothes with a windwaterproof on top   hat2 dont dri,
woivern doctor strange you dont have a phone thor no i dont have a phone but you couldve sent an electronic letter its called,
smithsonian alma thomas spent 38 years as a dc public school a teacher before her painting career took offin 1972 in her 80s,
if a customer is trying to limit their phone use where else might your brand have a chance to catch their attentio ,
rsnohants take it steady on our roads in nohants this evening please be patient with other drivers as their cars may not handl,
tear ,
airpos embrace dogs cats and horses to relax stressedout passengers while airlines crack down ,
riceandstew yall so this is my screensaver and my manager had my phone in her hand shes white the way my hea was beating i wa,
bentxrres shoutout all my dogs one time,
caseycagle delta nra i do not own a gun i agree with your position about deltatoday we single out nra members ,
mobile notch congress cuando todos quisieron ser el iphone x ,
chasing cars plays and i immediately sob,
iphone  ,
hackaday who did john glenn trust more than the computer to get him to the moon who did the trajectory analysis to put the first amer,
estos jaguars como aman alaurenjauregui  es increble  ,
futumalshamri             ,
moon to get first mobile phone network ,
ceraminic cute feather design at my etsy shop feather porcelain ring dish black white ceramic plate henna inspired jewelry dish t,
goodziiia her you spent our entire life savings on dogsme theyre golden retrievers karen they retrieve gold i did it for us,
sharellenicolee off top run a nigga out his socks niggas talk more than bitches niggas rlly be on cock tho just fucked a ho out in,
small abstract  turquoise green   white ,
naples service dogs providing comfo to students families in parkland after shooting ,
eusebius i just hope jacques is sma enough not to keep anything that might be of interest to the hawks at his ho ,
btctn pr education ecosystem announces token exchange listings and chance to win three tesla model s cars ,
trafficscotland  please do not walk your dogs on the motorwayseven if traffic appears to be at a standstill,
get on the phone jerry ,
coming up this weekend the ronettestune in to 1015fm on sundays from 12pm cst to learn a little about one of t ,
lmao id freak out and drop my phone on his head when he gets the door open    uk version of home alone  ,
caithuls relative you know about computers rightme has a degree in computer science no,
originalfunko    follow originalfunko for a chance to win a gamestop exclusive venompool with phone pop contestofchampions ,
rebeccashearer what you gonny dae aboot it phone the polismate we are the polis,
a nc husbands final gift diamond ring lost and found after deadly crash  ,
simongerman600 digital camera sales over time with sma phone cameras being sufficient for most snapshots the majority of people sto,
wow my secrets uncovered ,
rather than arming teachers how about two well trained guard dogs disciplined to recognize people with a gun  te ,
justandynow archiebs rsammysams foxnews flgovscott build a wall around every school then have students travel to school in armore,
derekcollison love this really enjoy that my friends at trueventures saw the oppounity cc puneet324 ,
fuck your lap dogsget a cat ,
nurinhanisah tadi time pilih cover phone with my mom  kenapa tak beli cover phone yg ada tutup skrin tu sekali org tua je beli c,
make5calls derekcnel we have the phone s and a handy call script to contact your statelevel representatives about gun reform too,
bluegill confetti ,
so several cars behind me were stuck sitting here behind this utter pillock whilst he delivered stuff to ,
serribargain omg confirmed serri will protect me with her key ring of death i said omoit seems like serri can protect me well ,
nwpolice sightings please for tony haigh age 49 missing from holyhead since friday fair complexion stocky build 59  tall brown,
asvid gorgeous painting by lioba brckner ,
its all fun and games until you find soyu photoshopped to sell a waterproof cell phone bag lol ,
hsbcuk took 30 mins for customer service to answer phone been with hsbc for over 40 years but will move my accou ,
futumalshamri                ,
aurelynmai jim halpe when hes gets in trouble with sabre for using his phone and not the pyramid then has to point the sign towards,
dnatf1  dna live  lucie et karim retrouvent le tlphone de mlanie dans les poubelles  cest louche  episode163 dna ,
funny dogs  a cute and funniest puppy videos compilation 3 ,
cdietrich1007 these dogs are so freakin helpful im in love ,
tucson electric issues new warning after spike in phonescam repos ,
thesugardad1 fancy helping me get a new phone ,
score another one for our fbi see they can do more than one thing at a time in case realdonaldtrump you didnt k ,
pettymamii my phone be so dry i be in my settings like ooouuu what this do  ,
coxhelp yeah its real helpful it tells me i went over give no details as to what activities are using the data ,
vv2a             100   ,
astronautabby laika belka strelka tsygan and dezik are all the names of dogs that have been sent into space learn more by watchi,
gostei de um vdeo do youtube ,
imagine being able to say oh i just got off the phone with oprah,
web ring was rejected by shark tank the founder asked for 700k at a 7m valuation in 2013 and it just sold to amazon for 1b,
jaydepierce sometimes i hate having a phone because people feel so entitled to talk to you and if you dont reply that day it means yo,
tipsyiphone,
bbiss666 sweatshis are great because you can hide your phone your hands and your low self esteem all at once,
frabjousid this is my friendhis name is abdullahi mudathir a 400l computer science student unilorinhes been declared missing sin,
realdonaldtrump i dont know donnie why dont you talk to him yourself  do you not know how to use a phone or se ,
joshuahump15 bospangles7 chadlynch21 8 big ten titles and he been had a ring you need to stop you just sound ignorant at this point,
my snap notifications about to break my phone ,
pennsylvania hoaglandrun flyfishing repo,
cdietrich1007 these dogs are so freakin helpful im in love ,
another great fishing   boating feature from carolina skiff ,
debbierfischer comfo therapy dogs waiting to greet stoneman douglas kids this morning for their first day back msdstrong ,
sahouraxo your words wouldnt ring so hollow had you not taken tens of millions of dollars from the misogynistic regimes of saudi arab,
h1dro comme quoi la mto de project cars 2 n est pas si farfelue ,
jackieaina were all grownpeople have lives jobs obligations etc unless youre my man my manager or family dont expect that,
drwhom everytime i have a customer service phone transaction with my health insurance provider that makes me want to rip my eyeballs,
canadamediabias dogs lives mattercriminals armed with guns broke into a house and shot a dog 3 timesmaybe the dog would not have,
lmao id freak out and drop my phone on his head when he gets the door open    uk version of home alone  ,
dollfacejamani i found the tongue ring video yall ,
vendo iphone 4sperfecto ,
put my parents in a group message and neither one of them has responded in over 24 hours thank goodness im not be ,
amrinam17 samsung galaxy j7 2015 32gb blackiphone 6s plus 64gb grey new ,
bintymustard ill be roaring too ive been painting tee shis and sacrificed a decent pair of stockings for a cats tail,
ungarmax is playing original gangstaz on my iphone click the link to join my gang ,
guys are dogs wym  ,
nerdyguy18 beylegion i guess im stpit my phone would not give it to me,
ryanstruyk sure sounds like he just said realdonaldtrump aka agolftwitler is trying to run the justice depamen ,
dreiste kopie  zum halben preis asus zenfone 5 sieht aus wie ein iphone x asus bringt ,
mombot just remembered that time a furry said i harassed him on the computer and all i did was send him a picture of a duck ,
this seems an impoant progress ,
rodgehatx dont go to the supermarketshops or phone a call centre or whatever in scotland today unless its fuckin urgent companie,
more car hud displays are coming and theyre getting better ,
trout redfish flounder   moregt go fishing today ,
get busy fishingbut first do this ,
 ,
icymi dyson is making electric cars ,
engxl so what you telling me is that this not a pixar movie  ,
alexcerdadiaz12 me dio justo en la pobreza ,
cant ever trust shark tank one of the hosts called black entrepreneurs colorful cockroaches and those ladies ,
ford and miami to form test bed for selfdriving cars  seattle times ,
cold weather bass fishing tacticsgt make the bite ,
i personally think its amazing how these dogs work ,
kodeinecrazy my future wife has her pinky finger on the bottom of her phone ring middle and index finger behind for suppo with he,
seargedp i want a faster computer one that needs less than a week to finish an infinite loop,
when you go to wendys and the entire staff greets you by name asks if you want the usual then gives you the pr ,
mal lebron and he aint even done yet and save the ring talk for ya momma,
611 antiradiation signal blocking case for cell phone size 23cm x 17cm black ,
kvngdeebrown him okay baby hangupher no you hang uphim well i guess we gone stay on the phone cus im not hanging upher ,
iphone,
dogs can help dramatically reduce ptsd symptoms in vets ,
vieron que la camara del iphone x tiene como un efecto raro como arenilla no me termino de dar cuenta si me re cabe o lo odio,
vv2a               ,
poorafauji ok writebut had he said cowardly india one more time i swear manishwould have climbed into the ,
using your phone at dinner isnt just rude its also making you unhappy ,
hsbcukbusiness so two weeks and still no welcome pack with all the online banking details after opening the accou ,
debbierfischer comfo therapy dogs waiting to greet stoneman douglas kids this morning for their first day back msdstrong ,
frabjousid this is my friendhis name is abdullahi mudathir a 400l computer science student unilorinhes been declared missing sin,
graytheron cheshirecat lonewolfarrieta cameronneal16 androids are ass get a iphone,
ok so i know i just posted selfies but alex took pics of me with his iphone 7 and aaaahhhhhhhhhh ,
we can go poopin let me charge my phone babe  me accidently calling hanzo babe,
were dog friendly dogs are welcome in our patio area and at designated tables at the bar  dogfriendly leighonsea,
cracked my iphone ,
harleypope  people in greenville my dogs jumped off the back of the truck somewhere around chic fil a if you see them pls let m,
computer enhance ,
handing environmentalists a landmark victory a german cou ruled tuesday that cities can ban diesel cars and ,
vladsavov if apple were to put bunny ears on the iphone on monday by wednesday wed have bunnyeared android phones in stores this i,
svlcvst san francisco california through the lens of an iphone x ,
vv2a             100   ,
priscillas dogs fifi and roxy our girls breathlesswines breathlessmoment breathlessdogs ,
my ipad screen was about to go dark and rather than pressing that i pressed my phone screen,
futumalshamri 23 ,
thegoodgodabove anyone else tired of all the madness i know i amthat does itim going to the planet of dogswho wants to come,
rapeseed fields  by jan rippingham acrylic painting a ,
demwrite arizona 8th meet your next representative to the us congress hiral4congress please follow special election against dar,
vice its downright disturbingpeople outside cars are dying at levels we havent seen in 25 years ,
no youre crying ,
debbierfischer comfo therapy dogs waiting to greet stoneman douglas kids this morning for their first day back msdstrong ,
contact us for more info 1 305 5931007 autopas jminterpa highquality repuestosautomotrices ,
greatestquotes i dream of painting and then i paint my dream  vincent van gogh,
come in out of the cold tomorrow we have joanne with us again doing free face painting  julie x,
jackieaina were all grownpeople have lives jobs obligations etc unless youre my man my manager or family dont expect that,
amyperuana overlooki sellittimr casalettori luciatassan papryka5 scastaldi9 asamsakti henrirouen agustingut paoloigna1 em,
samoloinc shantae since the risky boots dlc is out heres an slightly more riskycentric painting bigger size on tumblr ,
new post jeff hardy returning to the ring in time for wrestlemania 34 speculation on hardy return plans ,
debbierfischer comfo therapy dogs waiting to greet stoneman douglas kids this morning for their first day back msdstrong ,
gordiluv hey there i am godwin akpan i am a concept aist and illustrator i love painting story keyframes wearenigeriancreatives,
mombot just remembered that time a furry said i harassed him on the computer and all i did was send him a picture of a duck ,
juliettep0er dogs are a godsend i can be stressed out and see a dog a mile away and immediately feel so much better how are they so,
dogs are always allowed in the office if theres no office to repo to take advantage of the gigeconomy and ge ,
futumalshamri      ,
darrenrovell in november 2013 jamie siminoff came on shark tank valuing his wifi enabled video doorbell at 7 million four sharks pa,
trumpgirlstrong excuse me i dont want anyone or anything inside my home while im gone amazon ring yall are getting way too pers,
rjrecommended he had the ring and uncle knew who he was right away,
rain alarm xt se actualiza ofreciendo sopoe al iphone x ,
debbierfischer comfo therapy dogs waiting to greet stoneman douglas kids this morning for their first day back msdstrong ,
things that happen in phoenix az ,
that1blakginger i can snip that ring finger off green lantern im whooping his ass ,
danielknightpl sheriff israel of broward county wasted tax payers money to put his big face on 5 police cars this guy a narcissist a,
kendrickkross officialgwd trustinknight tweetsbytony11 you can watch them pull strings baldwin when it comes to business roerich,
petejohansson some winter advice for brits from a canadian1 layer your clothes with a windwaterproof on top   hat2 dont dri,
all of my friends retweet and help me win this ,
homie over here making memes and filth ,
 the fbi man in my computer i am ok trust me i just really like watching sad movies when im oveired this behavi ,
apple    iphone        ,
what if the city towed cars to cleared streets during snow emergencies rather than to the impound lot still give ,
vv2a              ,
johaningero erdogan slaskpussar sexring och pratar om hur hon ska bli mayr ungen grter zombierna i publiken applderardetta ,
groucidjamila rescue 0227 wan ting slaughterhouses changchun 20180227rescuers saved 97 dogs from wan ting slaughterhou,
kevinfarzad secrets to success wake up   check your phone for 40 minutes before getting out of bed whenever you park check your,
debbierfischer comfo therapy dogs waiting to greet stoneman douglas kids this morning for their first day back msdstrong ,
thefblife when your girl takes your phone and tries to run  ,
jackieaina were all grownpeople have lives jobs obligations etc unless youre my man my manager or family dont expect that,
jfreewright they tried this kinda thing on the other side can we pump brakes for a sec hold on lemme ring gd 718 ,
fannymorrell step by stepreal ring ,
ballardslane paulshea08 mrmustard they have to get their money somehow they dont like cars but they like the drivers money,
he aadido un vdeo a una lista de reproduccin de youtube ,
engxl so what you telling me is that this not a pixar movie  ,
bryanlanning thats dogs for you but she is cute,
benstarspos thank you for the aicle in todays rpgreyhounds  lets do all we can to keep the dogs on sky  towcestertv bruc,
every time i think ima get a day off to do what i gotta do my phone rings ,
dougdugie59 nativeshadows facingwestmusic boscotheman82 mccubbinjosh danatwick manutdfan1997 ,
timthetoolmann scam likely the only reason why my phone not dry,
photos from the james r hahn live painting exhibition speedpainting jameshahn ,
925 sterling silver diamond polished love knot ring  006 cttw ,
jackieaina were all grownpeople have lives jobs obligations etc unless youre my man my manager or family dont expect that,
b34bestevaer 1queenavatar1 julesywooooolsy thecleaner13 djinnthe warri0rreturns agirlandrea lukeyovaere bluesue180 oakeng,
man the heater broke down and my computer all jacked up with virussus and its mothfucka cold out here ,
vv2a          10 15  21      ,
mythvsfactss dogs cannot feel guilt  ,
jackieaina were all grownpeople have lives jobs obligations etc unless youre my man my manager or family dont expect that,
kevinfarzad secrets to success wake up   check your phone for 40 minutes before getting out of bed whenever you park check your,
originalfunko    follow originalfunko for a chance to win a gamestop exclusive venompool with phone pop contestofchampions ,
rapeseed fields  by jan rippingham acrylic painting a ,
when youre thinking back on the previous day and realize he called you my girl when on the phone with his friend ,
iphone x vs s9 plus vs s9 plus comparison review with camera test you w ,
amalahm79889275       15           ,
jessiejaneduff on 911 boxcutters were violent instruments of death and tragically murdered thousands of people in just a few minute,
johnboyega forgot my phone charger ,
i hate notifications on my phone that shit irks tf out of me  idk why im like this smh,
weve added new universal phone holder for bicycle at our store check it out here ,
klandpatrick weaves intricate exciting novels that have the ring of truth and possibility ,
asus zenfone 5z quick review comparison with iphone 10 judwa bhai gtu ,
razer if its not 120hz its not a gaming phoneenter the 120hzmobilemasterrace now  ,
sisdchat michiganliteracy ,
loueelouis uofl interim president postel is in the studios trying to make a pitino phone call mix tape for the fbi  postel is prayi,
claptonterrier omd sassvh is topless in the sun ,
klandpatrick weaves intricate exciting novels that have the ring of truth and possibility ,
pretty pistol announce new ep   release video for drive me to the dogs  prettypist themusicsite newmusic ,
streetvetuk at the weekend our bristol streetvets   vetnurses ran an outreach station seeing 6 dogs including regulars soph soph   gy,
jackieaina were all grownpeople have lives jobs obligations etc unless youre my man my manager or family dont expect that,
razer if its not 120hz its not a gaming phoneenter the 120hzmobilemasterrace now  ,
aists to fans put your phone away the last thing jack white wants to see when hes standing onstage is a sea ,
danielknightpl sheriff israel of broward county wasted tax payers money to put his big face on 5 police cars this guy a narcissist a,
carriedaway16 bamadness kbriquelet no not scary if you arent engaged in criminal activity   law enforcement didnt solely rely o,
